{
  "secid": "secid:control/disa.mil/ibm-aix-7-x@V3R3",
  "benchmark_id": "IBM_AIX_7-x_STIG",
  "xccdf_namespace": "http://checklists.nist.gov/xccdf/1.1",
  "title": "IBM AIX 7.x Security Technical Implementation Guide",
  "version": "3",
  "status": "accepted",
  "profiles": [
    {
      "id": "MAC-1_Classified",
      "title": "I - Mission Critical Classified",
      "selects": 283
    },
    {
      "id": "MAC-1_Public",
      "title": "I - Mission Critical Public",
      "selects": 283
    },
    {
      "id": "MAC-1_Sensitive",
      "title": "I - Mission Critical Sensitive",
      "selects": 283
    },
    {
      "id": "MAC-2_Classified",
      "title": "II - Mission Support Classified",
      "selects": 283
    },
    {
      "id": "MAC-2_Public",
      "title": "II - Mission Support Public",
      "selects": 283
    },
    {
      "id": "MAC-2_Sensitive",
      "title": "II - Mission Support Sensitive",
      "selects": 283
    },
    {
      "id": "MAC-3_Classified",
      "title": "III - Administrative Classified",
      "selects": 283
    },
    {
      "id": "MAC-3_Public",
      "title": "III - Administrative Public",
      "selects": 283
    },
    {
      "id": "MAC-3_Sensitive",
      "title": "III - Administrative Sensitive",
      "selects": 283
    }
  ],
  "status_date": "2026-06-15",
  "provenance": {
    "source_compilation": "U_SRG-STIG_Library_July_2026.zip",
    "inner_archive": "U_IBM_AIX_7-x_V3R3_STIG.zip",
    "inner_sha256": "95ab5ad65651d381eade98aa4078ed455387725e3823c08e04a2b757a00fcee8",
    "extractor": "scripts/extract_stigs.py"
  },
  "slug": "ibm-aix-7-x",
  "release": "V3R3",
  "kind": "STIG",
  "rule_count": 283,
  "rule_index": [
    "V-215169",
    "V-215170",
    "V-215171",
    "V-215172",
    "V-215173",
    "V-215174",
    "V-215175",
    "V-215176",
    "V-215177",
    "V-215178",
    "V-215179",
    "V-215180",
    "V-215181",
    "V-215182",
    "V-215183",
    "V-215184",
    "V-215186",
    "V-215187",
    "V-215188",
    "V-215189",
    "V-215190",
    "V-215191",
    "V-215192",
    "V-215193",
    "V-215194",
    "V-215195",
    "V-215196",
    "V-215197",
    "V-215198",
    "V-215199",
    "V-215200",
    "V-215201",
    "V-215202",
    "V-215203",
    "V-215204",
    "V-215205",
    "V-215206",
    "V-215207",
    "V-215208",
    "V-215209",
    "V-215210",
    "V-215211",
    "V-215212",
    "V-215213",
    "V-215214",
    "V-215215",
    "V-215216",
    "V-215217",
    "V-215218",
    "V-215219",
    "V-215220",
    "V-215221",
    "V-215222",
    "V-215223",
    "V-215225",
    "V-215226",
    "V-215227",
    "V-215229",
    "V-215230",
    "V-215231",
    "V-215232",
    "V-215233",
    "V-215234",
    "V-215235",
    "V-215236",
    "V-215237",
    "V-215238",
    "V-215239",
    "V-215240",
    "V-215241",
    "V-215242",
    "V-215243",
    "V-215244",
    "V-215245",
    "V-215246",
    "V-215247",
    "V-215248",
    "V-215249",
    "V-215250",
    "V-215251",
    "V-215252",
    "V-215253",
    "V-215254",
    "V-215255",
    "V-215256",
    "V-215257",
    "V-215258",
    "V-215259",
    "V-215260",
    "V-215261",
    "V-215262",
    "V-215263",
    "V-215264",
    "V-215265",
    "V-215266",
    "V-215267",
    "V-215268",
    "V-215269",
    "V-215270",
    "V-215271",
    "V-215272",
    "V-215273",
    "V-215274",
    "V-215275",
    "V-215276",
    "V-215277",
    "V-215278",
    "V-215279",
    "V-215280",
    "V-215281",
    "V-215282",
    "V-215283",
    "V-215284",
    "V-215285",
    "V-215286",
    "V-215287",
    "V-215288",
    "V-215289",
    "V-215290",
    "V-215291",
    "V-215292",
    "V-215293",
    "V-215294",
    "V-215295",
    "V-215296",
    "V-215297",
    "V-215298",
    "V-215299",
    "V-215300",
    "V-215301",
    "V-215302",
    "V-215303",
    "V-215304",
    "V-215305",
    "V-215306",
    "V-215308",
    "V-215309",
    "V-215310",
    "V-215311",
    "V-215312",
    "V-215313",
    "V-215314",
    "V-215315",
    "V-215316",
    "V-215317",
    "V-215318",
    "V-215320",
    "V-215321",
    "V-215322",
    "V-215323",
    "V-215324",
    "V-215325",
    "V-215326",
    "V-215327",
    "V-215328",
    "V-215329",
    "V-215330",
    "V-215331",
    "V-215332",
    "V-215333",
    "V-215334",
    "V-215335",
    "V-215336",
    "V-215337",
    "V-215338",
    "V-215339",
    "V-215340",
    "V-215341",
    "V-215342",
    "V-215343",
    "V-215344",
    "V-215345",
    "V-215346",
    "V-215347",
    "V-215348",
    "V-215349",
    "V-215350",
    "V-215351",
    "V-215352",
    "V-215353",
    "V-215354",
    "V-215355",
    "V-215356",
    "V-215357",
    "V-215358",
    "V-215359",
    "V-215360",
    "V-215361",
    "V-215362",
    "V-215363",
    "V-215364",
    "V-215365",
    "V-215366",
    "V-215367",
    "V-215368",
    "V-215369",
    "V-215370",
    "V-215371",
    "V-215372",
    "V-215373",
    "V-215374",
    "V-215375",
    "V-215376",
    "V-215377",
    "V-215378",
    "V-215379",
    "V-215380",
    "V-215381",
    "V-215382",
    "V-215383",
    "V-215384",
    "V-215385",
    "V-215386",
    "V-215387",
    "V-215388",
    "V-215389",
    "V-215390",
    "V-215391",
    "V-215392",
    "V-215393",
    "V-215394",
    "V-215395",
    "V-215396",
    "V-215397",
    "V-215398",
    "V-215399",
    "V-215400",
    "V-215401",
    "V-215402",
    "V-215403",
    "V-215404",
    "V-215405",
    "V-215406",
    "V-215407",
    "V-215408",
    "V-215409",
    "V-215410",
    "V-215411",
    "V-215412",
    "V-215413",
    "V-215414",
    "V-215415",
    "V-215416",
    "V-215417",
    "V-215418",
    "V-215419",
    "V-215420",
    "V-215421",
    "V-215422",
    "V-215423",
    "V-215424",
    "V-215425",
    "V-215426",
    "V-215427",
    "V-215428",
    "V-215429",
    "V-215430",
    "V-215431",
    "V-215432",
    "V-215433",
    "V-215434",
    "V-215435",
    "V-215436",
    "V-215437",
    "V-215438",
    "V-215439",
    "V-215440",
    "V-215441",
    "V-219057",
    "V-219956",
    "V-245557",
    "V-245558",
    "V-245559",
    "V-245560",
    "V-245561",
    "V-245562",
    "V-245563",
    "V-245564",
    "V-245565",
    "V-245566",
    "V-245567",
    "V-245568",
    "V-245569"
  ]
}
